question,option1,option2,option3,option4,correct,difficulty
When was Google founded?,"December 12, 1989","Feburary 7th, 2000","October 9, 1997","September 4, 1998","September 4, 1998",easy
What is the only state in the United States that does not have a flag in a shape with 4 edges?,Florida,Idaho,New Mexico,Ohio,Ohio,easy
What does the Prt Sc button do?,Captures whats on the screen and copies it to your clipboard,Closes all windows,Nothing,Saves a .png file of whats on the screen in your screenshots folder in photos,Captures whats on the screen and copies it to your clipboard,easy
Which of the following sports is not part of the triathlon?,Cycling,Horse-Riding,Running,Swimming,Horse-Riding,easy
What is the name of the peninsula containing Spain and Portugal?,European Peninsula,Iberian Peninsula,Peloponnesian Peninsula,Scandinavian Peninsula,Iberian Peninsula,easy
How many countries does the United States share a land border with?,1,2,3,4,2,easy
What is the capital of the US State of New York?,Albany,Buffalo,New York,Rochester,Albany,easy
The derisive acronym PIIGS refers to which of the following European countries and their economic statuses?,"Poland, Iceland, Italy, Greece, Serbia","Poland, Iceland, Italy, Greenland, Spain","Portugal, Iceland, Ireland, Greece, Serbia","Portugal, Ireland, Italy, Greece, Spain","Portugal, Ireland, Italy, Greece, Spain",easy
"In the 2014 FIFA World Cup, what was the final score in the match Brazil - Germany?",1-5,1-6,1-7,2-6,01-Jul,easy
Which of the following is NOT classified as a Semetic language?,Akkadian,Maltese,Mandaic,Sumerian,Sumerian,medium
"What is the name of the ship which was only a few miles away from the RMS Titanic when it struck an iceberg on April 14, 1912?",Californian,Carpathia,Commerce,Cristol,Californian,medium
What is the capital of Estonia?,Helsinki,Riga,Tallinn,Tartu,Tallinn,medium
What did the name of the Tor Anonymity Network orignially stand for?,The Ominous Router,The Onion Router,The Only Router,The Orange Router,The Onion Router,medium
"In a 1994 CBS interview, Microsoft co-founder Bill Gates performed what unusual trick on camera?",Jumping backwards over a desk,Jumping over an office chair,Standing on his head,Typing on a keyboard during a handstand,Jumping over an office chair,medium
What cricketing term denotes a batsman being dismissed with a score of zero?,Beamer,Bye,Carry,Duck,Duck,medium
"In 2016, who won the Formula 1 World Constructors Championship for the third time in a row?",McLaren Honda,Mercedes-AMG Petronas,Red Bull Racing Renault,Scuderia Ferrari,Mercedes-AMG Petronas,medium
"In computing terms, typically what does CLI stand for?",Command Line Interface,Common Language Input,Common Language Interface,Control Line Interface,Command Line Interface,medium
What year were the Marian Reforms instituted in the Roman Republic?,102 CE,107 BCE,264 BCE,42 BCE,107 BCE,medium
Where is the area commonly known as the Bermuda Triangle?,In the Caribbean Sea,"North Atlantic Ocean, between Florida and Puerto Rico","North Pacific Ocean, between Japan and the USA","South Pacific Ocean, far off Chile","North Atlantic Ocean, between Florida and Puerto Rico",medium
Which of these countrys capitals starts with the letter B?,Jordan,Kuwait,Lebanon,Qatar,Lebanon,medium
What is the capital of Chile?,Antofagasta,Copiap&oacute;,Santiago,Valpara&iacute;so,Santiago,medium
"What is the bloodiest event in United States history, in terms of casualties?",Battle of Antietam,D-Day,Pearl Harbor,September 11th,Battle of Antietam,medium
The now extinct species Thylacine was native to where?,"Baluchistan, Pakistan","Oregon, United States","Tasmania, Australia","Wallachia, Romania","Tasmania, Australia",medium
"A carnivorous animal eats flesh, what does a nucivorous animal eat?",Fruit,Nothing,Nuts,Seaweed,Nuts,medium
Which soccer team won the Copa Am&eacute;rica 2015 Championship ?,Argentina,Brazil,Chile,Paraguay,Chile,medium
What is the scientific name for the Polar Bear?,Polar Bear,Ursus Arctos,Ursus Maritimus,Ursus Spelaeus,Ursus Maritimus,medium
Which of the following player scored a hat-trick during their Manchester United debut?,Cristiano Ronaldo,David Beckham,Robin Van Persie,Wayne Rooney,Wayne Rooney,medium
What is the scientific name of the Budgerigar?,Ara macao,Melopsittacus undulatus,Nymphicus hollandicus,Pyrrhura molinae,Melopsittacus undulatus,hard
"After the 1516 Battle of Marj Dabiq, the Ottoman Empire took control of Jerusalem from which sultanate?",Ayyubid,Mamluk,Seljuq,Ummayyad,Mamluk,hard
Which musician has collaborated with American producer Porter Robinson and released the 2016 song Shelter?,Madeon,Mat Zo,Zedd,deadmau5,Madeon,hard
What is the capital city of Bermuda?,Hamilton,Havana,San Juan,Santo Dominigo,Hamilton,hard
When was the Siege of Leningrad lifted during World War II?,January 1944,March 1944,November 1943,September 1943,Jan-44,hard
When did the French Revolution begin?,1756,1789,1799,1823,1789,hard
Which of the following chemicals are found in eggplant seeds?,Cyanide,Mescaline,Nicotine,Psilocybin,Nicotine,hard
"Named after the mallow flower, mauve is a shade of what?",Brown,Pink,Purple,Red,Purple,hard
What immense structure is referred to in Norse Mythology as the Yggdrasil.,Castle,Mountain,Temple,Tree,Tree,hard
What is the area of Vatican City?,0.10km^2,0.44km^2,0.86km^2,12.00km^2,0.44km^2,hard
"Who is the creator of the soft drink, Dr. Pepper?",Boris Heviltik,Charles Alderton,James Wellington,Johnson Hinsin,Charles Alderton,hard
What North American tourist attraction is served by the Maid of the Mist tour company?,Disney World,Niagara Falls,"Whistler, British Columbia",Yosemite National Park,Niagara Falls,hard
Which of these animals is NOT a lizard?,Gila Monster,Green Iguana,Komodo Dragon,Tuatara,Tuatara,hard
How many paint and pastel versions of The Scream is Norwegian painter Edvard Munch believed to have produced?,1,2,3,4,4,hard
"During the Spanish Civil War (1936), Francisco Franco fought for which political faction?",Nationalist Spain,Papal State,Popular Front,Republican Spain,Nationalist Spain,hard
How many sonatas did Ludwig van Beethoven write?,21,31,32,50,32,hard
The Swedish word Grunka means what in English?,People,Pineapple,Place,Thing,Thing,hard
"If you planted the seeds of Quercus robur, what would grow?",Flowers,Grains,Trees,Vegetables,Trees,hard
Which of the following is not a type of computer mouse?,Drum mouse,Optical mouse,Smoothie mouse,Trackball mouse,Smoothie mouse,easy
"In any programming language, what is the most common way to iterate through an array?",Do-while loops,For loops,If Statements,While loops,For loops,easy
"When one is envious, they are said to be what color?",Blue,Green,Red,Yellow,Green,easy
What is the official language of Costa Rica?,Creole,English,Portuguese,Spanish,Spanish,easy
What is the capital of Scotland?,Dundee,Edinburgh,Glasgow,London,Edinburgh,easy
"In 1453, which important city fell?",Athens,Constantinople,Hamburg,Rome,Constantinople,easy
In DC comics where does the Green Arrow (Oliver Queen) live?,Central City,Gotham City,Metropolis,Star City,Star City,easy
What country has a horizontal bicolor red and white flag?,Bahrain,Liechenstein,Malta,Monaco,Monaco,easy
How many stars are featured on New Zealands flag?,0,2,4,5,4,easy
Which US state has the highest population?,California,Florida,New York,Texas,California,easy
The C programming language was created by this American computer scientist. ,Dennis Ritchie,Tim Berners Lee,Willis Ware,al-Khwārizmī,Dennis Ritchie,easy
Who was the first president of the United States?,George Washington,James K. Polk,James Madison,Thomas Jefferson,George Washington,easy
The derisive acronym PIIGS refers to which of the following European countries and their economic statuses?,"Poland, Iceland, Italy, Greece, Serbia","Poland, Iceland, Italy, Greenland, Spain","Portugal, Iceland, Ireland, Greece, Serbia","Portugal, Ireland, Italy, Greece, Spain","Portugal, Ireland, Italy, Greece, Spain",easy
Which of the following sports is not part of the triathlon?,Cycling,Horse-Riding,Running,Swimming,Horse-Riding,easy
What is the romanized Russian word for winter?,Leto,Osen,Vesna,Zima,Zima,medium
What is the oldest team in the NFL?,Arizona Cardinals,Chicago Bears,Green Bay Packers,New York Giants,Arizona Cardinals,medium
"What was the name of one of the surviving palaces of Henry VIII located near Richmond, London?",Buckingham Palace,Coughton Court,Hampton Court,St Jamess Palace,Hampton Court,medium
How many cores does the Intel i7-6950X have?,10,12,4,8,10,medium
What is the nickname of Northampton towns rugby union club?,Harlequins,Saints,Saracens,Wasps,Saints,medium
Who is the founder of The Lego Group?, Gerhardt Kirk Christiansen, Jens Niels Christiansen,Kirstine Christiansen,Ole Kirk Christiansen,Ole Kirk Christiansen,medium
How many sovereign states are members of the United Nations?,153,178,195,201,195,medium
The following Spanish provinces are located in the northern area of Spain except:,Asturias,Le&oacute;n,Murcia,Navarre,Murcia,medium
Which of the following buildings is example of a structure primarily built in the Art Deco architectural style?,Niagara Mohawk Building,One Detroit Center,Taipei 101,Westendstrasse 1,Niagara Mohawk Building,medium
Which of these countries is not a United Nations member state?,Montenegro,Niue,South Sudan,Tuvalu,Niue,medium
A doctor with a PhD is a doctor of what?,Philosophy,Phrenology,Physical Therapy,Psychology,Philosophy,medium
Which German city is located on the River Isar?,Berlin,Dortmund,Hamburg,Munich,Munich,medium
"After his loss at the Battle of Waterloo, Napoleon Bonaparte was exiled to which island?",Canary,Corsica,Elba,St. Helena,St. Helena,medium
How many timezones does Russia have?,11,16,24,6,11,medium
What type of animal is a natterjack?,Bird,Fish,Insect,Toad,Toad,medium
"In relation to the British Occupation in Ireland, what does the IRA stand for.",Irish Rebel Alliance,Irish Reformation Army,Irish Republican Army,Irish-Royal Alliance,Irish Republican Army,medium
Which soccer team won the Copa Am&eacute;rica 2015 Championship ?,Argentina,Brazil,Chile,Paraguay,Chile,medium
"In the programming language Python, which of these statements would display the string Hello World correctly?",console.log(Hello World),echo Hello World,print(Hello World),printf(Hello World),print(Hello World),medium
"What is the most significant side venture the popular firearms company, Remington, has pursued?",Blenders,Ceiling Fans,Door Knobs,Typewriters,Typewriters,medium
A minotaur is half human half what?,Bull,Cow,Eagle,Horse,Bull,medium
What is the full name of the footballer Cristiano Ronaldo?,Cristiano Armando Diego Ronaldo,Cristiano Luis Armando Ronaldo,Cristiano Ronaldo dos Santos Aveiro,Cristiano Ronaldo los Santos Diego,Cristiano Ronaldo dos Santos Aveiro,hard
Albrecht D&uuml;rers birthplace and place of death were in...,Augsburg,Bamberg,Berlin,N&uuml;rnberg,N&uuml;rnberg,hard
Dutch computer scientist Mark Overmars is known for creating which game development engine?,Construct,Game Maker,Stencyl,Torque 2D,Game Maker,hard
Pianist Fr&eacute;d&eacute;ric Chopin was a composer of which musical era?,Baroque,Classic,Renaissance,Romantic,Romantic,hard
"According to Fair Works Australia, how long do you have to work to get Long Service Leave?",2 years,6 months,7 years,8 years,7 years,hard
Which of these banks are NOT authorized to issue currency notes in Hong Kong?,Bank of China,HSBC,OCBC,Standard Chartered,OCBC,hard
Who is the founder of Palantir?,Jack Dorsey,Marc Benioff,Mark Zuckerberg,Peter Thiel,Peter Thiel,hard
"In addition to his career as an astrologer and prophet, Nostradamus published a 1555 treatise that included a section on what?",Cheating at card games,Digging graves,Making jams and jellies,Teaching parrots to talk,Making jams and jellies,hard
In 2012 the German-speaking microstate Liechtenstein in Central Europe had a population of how many inhabitants?,"2,400","323,400","36,600","90,000","36,600",hard
Who is the Egyptian god of reproduction and lettuce?,Menu,Meret,Min,Mut,Min,hard
What is the capital of Mauritius?,Port Louis,Port Moresby,Port Vila,Port-au-Prince,Port Louis,hard
The internet domain .fm is the country-code top-level domain for which Pacific Ocean island nation?,Fiji,Marshall Islands,Micronesia,Tuvalu,Micronesia,hard
"To which biological phylum do all mammals, birds and reptiles belong?",Annelida,Chordata,Echinodermata,Placazoa,Chordata,hard
Which of these theoretical phycisists first predicted the existence of antimatter?,Albert Einstein,Niels Bohr,Paul Dirac,Werner Heisenberg,Paul Dirac,hard
"From 1940 to 1942, what was the capital-in-exile of Free France ?",Algiers,Brazzaville,Paris,Tunis,Brazzaville,hard
Spain was formed in 1469 with the marriage of Isabella I of Castile and Ferdinand II of what other Iberian kingdom?,Aragon,Galicia,Le&oacute;n,Navarre,Aragon,hard
Which musician has collaborated with American producer Porter Robinson and released the 2016 song Shelter?,Madeon,Mat Zo,Zedd,deadmau5,Madeon,hard
Who assassinated President James A. Garfield?,Charles Guiteau,John Wilkes Booth,Leon Czolgosz,Sirhan Sirhan,Charles Guiteau,hard
"During World War I, which nations monarchs were blood related?","England, Germany, Russia","France, Russia, Germany","Germany, Spain, Austria","Serbia, Russia, Croatia","England, Germany, Russia",hard
What port does HTTP run on?,23,443,53,80,80,hard
"According to the 2014-2015 Australian Bureau of Statistics, what percentage of Australians were born overseas?",13%,20%,28%,7%,28%,hard
Nidhogg is a mythical creature from what mythology?,Egyptian,Greek,Hindu,Norse,Norse,hard
What mythology did the god Apollo come from?,Greek and Chinese,Greek and Roman,"Greek, Roman and Norse",Roman and Spanish,Greek and Roman,easy
How many furlongs are there in a mile?,Eight,Four,Six,Two,Eight,easy
"In 1453, which important city fell?",Athens,Constantinople,Hamburg,Rome,Constantinople,easy
Who is the youngest person to recieve a Nobel Prize?,Lawrence Bragg,Malala Yousafzai,Werner Heisenberg,Yasser Arafat,Malala Yousafzai,easy
"Which Greek &amp; Roman god was known as the god of music, truth and prophecy, healing, the sun and light, plague, poetry, and more?",Aphrodite,Apollo,Artemis,Athena,Apollo,easy
Which programming language shares its name with an island in Indonesia?,C,Jakarta,Java,Python,Java,easy
Which two teams played in Super Bowl XLII?,The Green Bay Packers &amp; The Pittsburgh Steelers,The New York Giants &amp; The New England Patriots,The Philadelphia Eagles &amp; The New England Patriots,The Seattle Seahawks &amp; The Denver Broncos,The New York Giants &amp; The New England Patriots,easy
This Greek goddesss name was chosen for the dwarf planet responsible for discord on Plutos classification amongst astronomers.,Ceres,Charon,Dysnomia,Eris,Eris,easy
How many time zones does China have?,1,2,3,4,1,easy
How many federal states does Germany have?,13,16,25,32,16,easy
Which of the following African countries was most successful in resisting colonization?,C&ocirc;te d&rsquo;Ivoire,Congo,Ethiopia,Namibia,Ethiopia,easy
The collapse of the Soviet Union took place in which year?,1891,1990,1991,1992,1991,easy
Which of the following European languages is classified as a language isolate?,Basque,Galician,Hungarian,Maltese,Basque,easy
Which Nation DID NOT have a Colony in Modern-day America?,Netherlands,Portugal,Spain,Sweden,Portugal,medium
Where did the pineapple plant originate?,Asia,Europe,Hawaii,South America,South America,medium
Which coding language was the #1 programming language in terms of usage on GitHub in 2015?,C#,JavaScript,PHP,Python,JavaScript,medium
Which of these countries national teams qualified for the 2018 FIFA World Cup in Russia?,Italy,Netherlands,Tunisia,United States of America,Tunisia,medium
"The Maori hold that which island nation was founded by Kupe, who discovered it under a long white cloud?",Fiji,Hawaii,New Zealand,Vanuatu,New Zealand,medium
In which English county is Stonehenge?,Cumbria,Herefordshire,Somerset,Wiltshire,Wiltshire,medium
Which Louis was known as The Sun King of France?,Louis XIII,Louis XIV,Louis XV,Louis XVI,Louis XIV,medium
In which years did the Battle of Gallipoli take place?,1914 - 1915,1914 - 1918,1915 - 1916,1915 - 1918,1915 - 1916,medium
What is the smallest country in South America by area?,Brazil,Chile,Suriname,Uruguay,Suriname,medium
Which of these countries was sea charted in 1500 by the Portuguese maritime explorations?,Brazil,India,Madagascar,Mozambique,Brazil,medium
"In 1845, a series of wars named after which indigenous people began in New Zealand?",Aborigines,Māori,Papuans,Polynesians,Māori,medium
What year was Apple Inc. founded?,1974,1976,1978,1980,1976,medium
What is the main CPU is the Sega Mega Drive / Sega Genesis?,Intel 8088,Motorola 68000,Yamaha YM2612,Zilog Z80,Motorola 68000,medium
"Which slogan did the fast food company, McDonalds, use before their Im Lovin It slogan?",Have It Your Way,Making People Happy Through Food,We Love to See You Smile,Why Pay More!?,We Love to See You Smile,medium
What number does the Roman numeral D stand for?,100,1000,50,500,500,medium
What is Canadas largest island?,Baffin Island,Newfoundland,Prince Edward Island,Vancouver Island,Baffin Island,hard
Which round does a WW2 M1 Garand fire?,.30-06,.308,7.62,7.62x51mm,.30-06,hard
When was the Siege of Leningrad lifted during World War II?,January 1944,March 1944,November 1943,September 1943,Jan-44,hard
Chartreuse is a color between yellow and what?,Black,Green,Purple,Red,Green,hard
"Located in Chile, El Teniente is the worlds largest underground mine for what metal?",Copper,Iron,Nickel,Silver,Copper,hard
What major programming language does Unreal Engine 4 use?,Assembly,C#,C++,ECMAScript,C++,hard
The word aprosexia means which of the following?,A feverish desire to rip ones clothes off,The inability to concentrate on anything,The inability to make decisions,The inability to stand up,The inability to concentrate on anything,hard
Which of the following is another name for the Poecilotheria Metallica Tarantula?,Gooty,Hopper,Silver Stripe,Woebegone,Gooty,hard
What was Napoleon Bonapartes name before he changed it?,Naapolion van Bonijpaart,Napole&atilde;o do Boaparte,Napoleona de Buenoparte,Napoleone di Buonaparte,Napoleone di Buonaparte,hard
Which country was NOT formerly part of Yugoslavia?,Albania,Croatia,Macedonia,Serbia,Albania,hard
What is &ldquo;The Sport of Kings&rdquo;?,Chess,Fencing,Horse Racing,Jousting,Horse Racing,hard
Which of these cities does NOT have a United States Minting location?,"Philidelphia, PA","San Fransisco, CA","St. Louis, MO","West Point, NY","St. Louis, MO",hard
"When was the city of Rome, Italy founded?",524 BCE,697 BCE,753 BCE,902 BCE,753 BCE,hard
What is the capital of Mauritius?,Port Louis,Port Moresby,Port Vila,Port-au-Prince,Port Louis,hard
Which of these positions did the astronomer and physicist Isaac Newton not hold?,Member of Parliament,Professor of Mathematics,Surveyor to the City of London,Warden of the Royal Mint,Surveyor to the City of London,hard
Which data structure does FILO apply to?,Heap,Queue,Stack,Tree,Stack,hard
"Lenovo acquired IBMs personal computer division, including the ThinkPad line of laptops and tablets, in what year?",1999,2002,2005,2008,2005,hard
Which restaurants mascot is a clown?,Burger King,McDonalds,Sonic,Whataburger,McDonalds,easy
The derisive acronym PIIGS refers to which of the following European countries and their economic statuses?,"Poland, Iceland, Italy, Greece, Serbia","Poland, Iceland, Italy, Greenland, Spain","Portugal, Iceland, Ireland, Greece, Serbia","Portugal, Ireland, Italy, Greece, Spain","Portugal, Ireland, Italy, Greece, Spain",easy
The Ottoman Empire was dissolved after their loss in which war?,Crimean War,Second Balkan War,Serbian Revolution,World War I,World War I,easy
"On Twitter, what was the original character limit for a Tweet?",100,120,140,160,140,easy
This Greek goddesss name was chosen for the dwarf planet responsible for discord on Plutos classification amongst astronomers.,Ceres,Charon,Dysnomia,Eris,Eris,easy
Which ocean borders the west coast of the United States?,Arctic,Atlantic,Indian,Pacific,Pacific,easy
What do you call a baby bat?,Chick,Cub,Kid,Pup,Pup,easy
Which of the following Japanese islands is the biggest?,Hokkaido,Honshu,Kyushu,Shikoku,Honshu,easy
Which country hosted the 2018 FIFA World Cup?,Germany,Russia,Saudi Arabia,United States,Russia,easy
"If you are caught Goldbricking, what are you doing wrong?",Cheating,Slacking,Smoking,Stealing,Slacking,easy
"Which player holds the NHL record of 2,857 points?",Gordie Howe,Mario Lemieux ,Sidney Crosby,Wayne Gretzky,Wayne Gretzky,easy
Which nation claims ownership of Antarctica?,Australia,"No one, but there are claims.",United Nations,United States of America,"No one, but there are claims.",easy
Which gaming console is developed by Sony?,Atari,Nintendo Switch,PlayStation,Xbox,PlayStation,easy
What is the capital of South Korea?,Kitakyushu,Pyongyang,Seoul,Taegu,Seoul,easy
What is the capital of the American state of Arizona?,Montgomery,Phoenix,Raleigh,Tallahassee,Phoenix,easy
Which Russian oblast forms a border with Poland?,Kaliningrad,Nizhny Novgorod,Omsk,Samara,Kaliningrad,easy
"What is the name of the popular animatronic singing fish prop, singing such hits such as Dont Worry, Be Happy?",Big Billy Bass,Big Mouth Billy Bass,Sardeen,Singing Fish,Big Mouth Billy Bass,medium
"According to Japanese folklore, what is the favorite food of the Kappa.",Cucumbers,Kabocha,Nasu,Soba,Cucumbers,medium
What direction does the Statue of Liberty face?,Northeast,Northwest,Southeast,Southwest,Southeast,medium
Which of the following is not in the Indo-European language family?,English,Finnish,Hindi,Russian,Finnish,medium
How many countries share a land border with Luxembourg?,2,3,4,5,3,medium
The seed drill was invented by which British inventor?,Charles Babbage,Isaac Newton,J.J Thomson,Jethro Tull,Jethro Tull,medium
Which of these programming languages is a low-level language?,Assembly,C#,Pascal,Python,Assembly,medium
Neptunes greek name was...,Apollo,Ares,Poseidon,Zeus,Poseidon,medium
"In a standard set of playing cards, which is the only king without a moustache?",Clubs,Diamonds,Hearts,Spades,Hearts,medium
What is the capital of Australia?,Brisbane,Canberra,Melbourne,Sydney,Canberra,medium
Hera is god of...,Agriculture,Marriage,Sea,War,Marriage,medium
What is a dakimakura?,"A Chinese meal, essentially composed of fish",A body pillow,A word used to describe two people who truly love each other,A yoga posture,A body pillow,medium
Which of these is NOT an island that is part of the Philippines?,Java,Luzon,Mindanao,Palawan,Java,medium
In the server hosting industry IaaS stands for...,Infrastructure as a Server,Infrastructure as a Service,Internet and a Server,Internet as a Service,Infrastructure as a Service,medium
"In the 2016 Global Peace Index poll, out of 163 countries, what was the United States of America ranked?",10,103,59,79,103,medium
Which iconic Disneyland attraction was closed in 2017 to be remodeled as a Guardians of the Galaxy themed ride?,Peter Pans Flight,Pirates of the Caribbean,The Haunted Mansion,Twilight Zone Tower of Terror,Twilight Zone Tower of Terror,medium
Joseph Stalin had a criminal past doing what?,Identity Fraud,Murder for Hire,Robbing Trains,Tax Evasion,Robbing Trains,medium
The website Shut Up &amp; Sit Down reviews which form of media?,Board Games,Films,Television Shows,Video Games,Board Games,medium
What is the name of the Boeing B-29 that dropped the Little Boy atomic bomb on Hiroshima?,Enola Gay,Full House,Necessary Evil,The Great Artiste,Enola Gay,hard
What is the most commonly used noun in the English language?,Home,Man,Time,Water,Time,hard
What vulnerability ranked #1 on the OWASP Top 10 in 2013?,Broken Authentication,Cross-Site Scripting,Injection ,Insecure Direct Object References,Injection ,hard
Which country is completely landlocked by South Africa?,Botswana,Lesotho,Swaziland,Zimbabwe,Lesotho,hard
What does the International System of Quantities refer 1024 bytes as?,Kelobyte,Kibibyte,Kilobyte,Kylobyte,Kibibyte,hard
"What national museum will you find in Cooperstown, New York?",Metropolitan Museum of Art,Museum of Modern Art,National Baseball Hall of Fame,National Toy Hall of Fame,National Baseball Hall of Fame,hard
The ancient city of Chich&eacute;n Itz was built by which civilization?,Aztecs,Incas,Mayans,Toltecs,Mayans,hard
Which Norse God has a horse named Sleipnir?,Balder,Frigg,Odin,Thor,Odin,hard
Which of these is a colony of polyps and not a jellyfish?,Irukandji,Portuguese Man-of-War,Sea Nettle,Sea Wasp,Portuguese Man-of-War,hard
What type of creature is a Bonobo?,Ape,Lion,Parrot,Wildcat,Ape,hard
What was the punishment for Sysiphuss craftiness?,Cursed to roll a boulder up a hill for eternity.,Standing in a lake filled with water he could not drink.,"Tied to a boulder for eternity, being pecked by birds.",To fell a tree that regenerated after every axe swing.,Cursed to roll a boulder up a hill for eternity.,hard
Which of the following is used to measure blood pressure?,Barometer,Haemoerythrometer,Ruler,Sphygmomanometer,Sphygmomanometer,hard
"Who is a minor god that is protector and creator of various arts, such as cheese making and bee keeping.",Aristaeus,Autonoe,Carme,Cephisso,Aristaeus,hard
Which film star has his statue in Leicester Square?,Alfred Hitchcock,Charlie Chaplin,Paul Newman,Rowan Atkinson ,Charlie Chaplin,hard
Which English king was married to Eleanor of Aquitaine?,Henry I,Henry II,Henry V,Richard I,Henry II,hard
How many countries does Mexico border?,1,2,3,4,3,easy
What zodiac sign is represented by a pair of scales?,Aries,Capricorn,Libra,Sagittarius,Libra,easy
Which one of these tanks was designed and operated by the United Kingdom?,M4 Sherman,T-34,Tiger H1,Tog II,Tog II,easy
